<?xml version="1.0" encoding="UTF-8"?>
<dataroot xmlns:od="urn:schemas-microsoft-com:officedata" xmlns:xsi="http://www.w3.org/2000/10/XMLSchema-instance"  xsi:noNamespaceSchemaLocation="ore.xsd">
<ore>
<idfoglio>F0000</idfoglio>
<idgiorno>0</idgiorno>
<idora>0</idora>
<orainizio>8.00</orainizio>
<orafine>8.50</orafine>
</ore>
<ore>
<idfoglio>F0000</idfoglio>
<idgiorno>0</idgiorno>
<idora>1</idora>
<orainizio>8.50</orainizio>
<orafine>9.50</orafine>
</ore>
<ore>
<idfoglio>F0000</idfoglio>
<idgiorno>0</idgiorno>
<idora>2</idora>
<orainizio>9.50</orainizio>
<orafine>10.45</orafine>
</ore>
<ore>
<idfoglio>F0000</idfoglio>
<idgiorno>0</idgiorno>
<idora>3</idora>
<orainizio>10.55</orainizio>
<orafine>11.50</orafine>
</ore>
<ore>
<idfoglio>F0000</idfoglio>
<idgiorno>0</idgiorno>
<idora>4</idora>
<orainizio>11.50</orainizio>
<orafine>12.45</orafine>
</ore>
<ore>
<idfoglio>F0000</idfoglio>
<idgiorno>0</idgiorno>
<idora>5</idora>
<orainizio>12.55</orainizio>
<orafine>13.50</orafine>
</ore>
<ore>
<idfoglio>F0000</idfoglio>
<idgiorno>0</idgiorno>
<idora>6</idora>
<orainizio>13.50</orainizio>
<orafine>14.40</orafine>
</ore>
<ore>
<idfoglio>F0000</idfoglio>
<idgiorno>1</idgiorno>
<idora>0</idora>
<orainizio>8.00</orainizio>
<orafine>8.50</orafine>
</ore>
<ore>
<idfoglio>F0000</idfoglio>
<idgiorno>1</idgiorno>
<idora>1</idora>
<orainizio>8.50</orainizio>
<orafine>9.50</orafine>
</ore>
<ore>
<idfoglio>F0000</idfoglio>
<idgiorno>1</idgiorno>
<idora>2</idora>
<orainizio>9.50</orainizio>
<orafine>10.45</orafine>
</ore>
<ore>
<idfoglio>F0000</idfoglio>
<idgiorno>1</idgiorno>
<idora>3</idora>
<orainizio>10.55</orainizio>
<orafine>11.50</orafine>
</ore>
<ore>
<idfoglio>F0000</idfoglio>
<idgiorno>1</idgiorno>
<idora>4</idora>
<orainizio>11.50</orainizio>
<orafine>12.45</orafine>
</ore>
<ore>
<idfoglio>F0000</idfoglio>
<idgiorno>1</idgiorno>
<idora>5</idora>
<orainizio>12.55</orainizio>
<orafine>13.50</orafine>
</ore>
<ore>
<idfoglio>F0000</idfoglio>
<idgiorno>1</idgiorno>
<idora>6</idora>
<orainizio>13.50</orainizio>
<orafine>14.40</orafine>
</ore>
<ore>
<idfoglio>F0000</idfoglio>
<idgiorno>2</idgiorno>
<idora>0</idora>
<orainizio>8.00</orainizio>
<orafine>8.50</orafine>
</ore>
<ore>
<idfoglio>F0000</idfoglio>
<idgiorno>2</idgiorno>
<idora>1</idora>
<orainizio>8.50</orainizio>
<orafine>9.50</orafine>
</ore>
<ore>
<idfoglio>F0000</idfoglio>
<idgiorno>2</idgiorno>
<idora>2</idora>
<orainizio>9.50</orainizio>
<orafine>10.45</orafine>
</ore>
<ore>
<idfoglio>F0000</idfoglio>
<idgiorno>2</idgiorno>
<idora>3</idora>
<orainizio>10.55</orainizio>
<orafine>11.50</orafine>
</ore>
<ore>
<idfoglio>F0000</idfoglio>
<idgiorno>2</idgiorno>
<idora>4</idora>
<orainizio>11.50</orainizio>
<orafine>12.45</orafine>
</ore>
<ore>
<idfoglio>F0000</idfoglio>
<idgiorno>2</idgiorno>
<idora>5</idora>
<orainizio>12.55</orainizio>
<orafine>13.50</orafine>
</ore>
<ore>
<idfoglio>F0000</idfoglio>
<idgiorno>2</idgiorno>
<idora>6</idora>
<orainizio>13.50</orainizio>
<orafine>14.40</orafine>
</ore>
<ore>
<idfoglio>F0000</idfoglio>
<idgiorno>3</idgiorno>
<idora>0</idora>
<orainizio>8.00</orainizio>
<orafine>8.50</orafine>
</ore>
<ore>
<idfoglio>F0000</idfoglio>
<idgiorno>3</idgiorno>
<idora>1</idora>
<orainizio>8.50</orainizio>
<orafine>9.50</orafine>
</ore>
<ore>
<idfoglio>F0000</idfoglio>
<idgiorno>3</idgiorno>
<idora>2</idora>
<orainizio>9.50</orainizio>
<orafine>10.45</orafine>
</ore>
<ore>
<idfoglio>F0000</idfoglio>
<idgiorno>3</idgiorno>
<idora>3</idora>
<orainizio>10.55</orainizio>
<orafine>11.50</orafine>
</ore>
<ore>
<idfoglio>F0000</idfoglio>
<idgiorno>3</idgiorno>
<idora>4</idora>
<orainizio>11.50</orainizio>
<orafine>12.45</orafine>
</ore>
<ore>
<idfoglio>F0000</idfoglio>
<idgiorno>3</idgiorno>
<idora>5</idora>
<orainizio>12.55</orainizio>
<orafine>13.50</orafine>
</ore>
<ore>
<idfoglio>F0000</idfoglio>
<idgiorno>3</idgiorno>
<idora>6</idora>
<orainizio>13.50</orainizio>
<orafine>14.40</orafine>
</ore>
<ore>
<idfoglio>F0000</idfoglio>
<idgiorno>4</idgiorno>
<idora>0</idora>
<orainizio>8.00</orainizio>
<orafine>8.50</orafine>
</ore>
<ore>
<idfoglio>F0000</idfoglio>
<idgiorno>4</idgiorno>
<idora>1</idora>
<orainizio>8.50</orainizio>
<orafine>9.50</orafine>
</ore>
<ore>
<idfoglio>F0000</idfoglio>
<idgiorno>4</idgiorno>
<idora>2</idora>
<orainizio>9.50</orainizio>
<orafine>10.45</orafine>
</ore>
<ore>
<idfoglio>F0000</idfoglio>
<idgiorno>4</idgiorno>
<idora>3</idora>
<orainizio>10.55</orainizio>
<orafine>11.50</orafine>
</ore>
<ore>
<idfoglio>F0000</idfoglio>
<idgiorno>4</idgiorno>
<idora>4</idora>
<orainizio>11.50</orainizio>
<orafine>12.45</orafine>
</ore>
<ore>
<idfoglio>F0000</idfoglio>
<idgiorno>4</idgiorno>
<idora>5</idora>
<orainizio>12.55</orainizio>
<orafine>13.50</orafine>
</ore>
<ore>
<idfoglio>F0000</idfoglio>
<idgiorno>4</idgiorno>
<idora>6</idora>
<orainizio>13.50</orainizio>
<orafine>14.40</orafine>
</ore>
</dataroot>
